{
  "schema_version": 1,
  "id": "es-442-platanos-negros",
  "article_number": 442,
  "translation_group": "442-why-bananas-turn-black",
  "language": "es",
  "locale": "es-ES",
  "market_context": "España/Unión Europea; maduración, pardeamiento y daño por frío en plátanos.",
  "title": "Por qué los plátanos se ponen negros",
  "slug": "por-que-platanos-se-ponen-negros",
  "seo": {
    "title": "Por qué los plátanos se ponen negros",
    "meta_description": "La piel se oscurece por maduración, oxidación y daño celular. El frío también puede ennegrecer la cáscara sin que la pulpa esté necesariamente mala.",
    "search_intent": "Entender por qué la piel del plátano se vuelve marrón o negra y cuándo sigue siendo comestible."
  },
  "excerpt": "El plátano se oscurece a medida que madura porque sus tejidos cambian y los compuestos fenólicos se oxidan. Golpes y frío aceleran el pardeamiento. Una piel casi negra puede esconder una pulpa aún comestible; moho, olor fermentado intenso, líquido o pulpa podrida son señales distintas.",
  "taxonomy": {
    "food_family": "fruit",
    "food_subcategories": [],
    "article_types": [
      "cooking-science",
      "buying-quality-ripeness"
    ],
    "primary_article_type": "cooking-science"
  },
  "content_html": "<p>Un plátano amarillo puede llenarse de puntos marrones en uno o dos días y terminar casi negro. <strong>El cambio de la piel forma parte de la maduración, pero también puede intensificarse por golpes o por frío.</strong></p><h2>Madurar implica transformar almidón en azúcares</h2><p>El plátano es climatérico. Durante la maduración aumenta la actividad asociada al etileno, la pulpa se ablanda y gran parte del almidón se convierte en azúcares solubles. Al mismo tiempo, la clorofila de la piel desaparece y se hacen visibles pigmentos amarillos.</p><h2>Después llega el pardeamiento</h2><p>Con la edad y el daño celular, enzimas y compuestos fenólicos entran en contacto con oxígeno y forman pigmentos marrones. Los pequeños puntos suelen multiplicarse a medida que el tejido envejece.</p><h2>El frío puede ennegrecer la piel antes de tiempo</h2><p>UC Davis describe daño por frío en plátanos expuestos durante suficiente tiempo a temperaturas inferiores a unos 13 °C. Puede aparecer decoloración marrón o negra en la piel, mientras la pulpa no siempre está igual de deteriorada. Por eso meter un plátano ya maduro en la nevera puede ennegrecer la cáscara aunque el interior siga siendo aprovechable.</p><h2>La piel y la pulpa no envejecen al mismo ritmo</h2><p>Un plátano puede presentar manchas marrones o una piel casi negra y mantener una pulpa perfectamente utilizable. El color externo responde con rapidez a golpes, frío y actividad enzimática, mientras que el interior puede conservar buena textura durante más tiempo. Por eso conviene abrirlo antes de decidir.</p><p>Cuando la pulpa también se vuelve excesivamente acuosa, presenta olor fermentado, moho o zonas claramente deterioradas, ya no hablamos solo de maduración. Separar “piel fea” de “fruta estropeada” evita desperdicio sin ignorar señales reales.</p><h2>Cuándo se puede comer</h2><p>Si la pulpa huele normal, no tiene moho y conserva una textura compatible con un plátano muy maduro, puede usarse aunque la piel esté oscura. De hecho, los plátanos muy maduros funcionan bien en bizcochos, tortitas o batidos.</p><p><strong>Negro por madurez no es lo mismo que podrido: abre, huele y evalúa la pulpa, no sólo la piel.</strong></p><h2>El etileno permite acelerar o frenar la maduración</h2>\n<p>Los plátanos producen etileno, una hormona vegetal gaseosa que coordina muchos cambios de maduración. Agruparlos en una bolsa de papel puede concentrar ese gas y acelerar el proceso; separarlos de otras frutas climatéricas y mantenerlos en un lugar más fresco puede ralentizarlo. Una bolsa cerrada de plástico no es equivalente, porque también atrapa humedad y favorece condensación.</p>\n<p>Si quieres que maduren antes, una manzana o un plátano ya maduro en la misma bolsa de papel puede aumentar la exposición a etileno.</p>\n<h2>La nevera sirve cuando la pulpa ya ha alcanzado el punto que buscas</h2>\n<p>Meter un plátano verde en frío puede oscurecer la piel y frenar el desarrollo normal del sabor. En cambio, refrigerar un plátano ya maduro puede prolongar algo la buena textura interior aunque la cáscara se vuelva marrón o negra. Esa diferencia explica por qué el aspecto exterior puede parecer peor mientras la pulpa todavía está en buen estado.</p>\n<p>Para varios días, también se puede pelar, trocear y congelar la fruta madura destinada a batidos o repostería.</p>\n<h2>Negro no significa automáticamente podrido</h2>\n<p>Una cáscara muy oscura suele indicar madurez avanzada, no contaminación. Al abrirlo, busca una pulpa blanda y dulce pero sin moho, olor fermentado intenso, zonas acuosas anormales o signos de descomposición. Las manchas marrones internas pequeñas son frecuentes en fruta muy madura.</p>\n<p>El punto ideal depende del uso: amarillo firme para comer a rodajas, moteado para más dulzor y muy maduro para bizcochos o tortitas. Aprovechar cada fase reduce desperdicio sin confundir maduración normal con deterioro.</p><p>El tallo también pierde agua y puede ser una vía de entrada de daños, pero envolver únicamente la corona no detiene por completo el etileno que produce toda la fruta. Es una medida secundaria. Temperatura, madurez inicial y cercanía de otras frutas pesan más. Comprar algunos plátanos verdes y otros amarillos puede escalonar el consumo mejor que intentar frenar todo el racimo a la vez.</p><p>Los golpes también pueden crear manchas oscuras internas antes de que el resto del plátano esté muy maduro. Son zonas de células dañadas y no equivalen al moteado normal de la cáscara. Un pequeño golpe puede retirarse si el resto huele y se ve normal; tejido acuoso extendido, moho o líquido rezumando ya indican deterioro.</p>",
  "faq": [
    {
      "question": "¿Un plátano con piel negra se puede comer?",
      "answer": "A menudo sí. Si la pulpa está normal, sin moho ni olor podrido, una piel negra por madurez o frío no lo hace inseguro por sí sola."
    },
    {
      "question": "¿Por qué se pone negro en la nevera?",
      "answer": "El frío puede dañar la piel y acelerar el pardeamiento, especialmente en plátanos sensibles a temperaturas bajas."
    },
    {
      "question": "¿Los puntos marrones significan más azúcar?",
      "answer": "Suelen aparecer en fases avanzadas de maduración, cuando ya se ha convertido mucho almidón en azúcares, aunque los puntos no miden exactamente el azúcar."
    }
  ],
  "sources": [
    {
      "name": "UC Davis Postharvest Research and Extension Center — Banano (Plátano)",
      "url": "https://postharvest.ucdavis.edu/es/produce-facts-sheets/banano-platano",
      "note": "Describe maduración, daño por frío, abrasiones y oscurecimiento de la piel."
    }
  ],
  "image": {
    "concept": "Secuencia de plátanos desde amarillo a moteado marrón y piel casi negra, con pulpa interior aún clara en uno de ellos, fotografía editorial realista, sin texto.",
    "alt": "Plátanos en distintas fases de oscurecimiento"
  },
  "status": "publish"
}
