{
  "schema_version": 1,
  "id": "en-160-raw-vs-cooked-spinach",
  "article_number": 160,
  "translation_group": "160-raw-vs-cooked-spinach",
  "language": "en",
  "locale": "en-US",
  "market_context": "United States/general English; USDA raw/cooked spinach composition",
  "title": "Raw vs. cooked spinach: nutrients and differences",
  "slug": "raw-vs-cooked-spinach",
  "seo": {
    "title": "Raw vs. cooked spinach: nutrition compared",
    "meta_description": "Cooking collapses spinach volume and concentrates minerals per 100 g, while vitamin C and folate can decline. Boiling can also remove some soluble oxalate.",
    "search_intent": "Compare raw and cooked spinach and understand why nutrient numbers change so much."
  },
  "excerpt": "The biggest difference between raw and cooked spinach is volume. One hundred grams raw is a large bowl; 100 g cooked is compact. Iron and calcium therefore look higher per 100 g after cooking, while vitamin C and folate can fall with heat and water. Boiling can also remove some soluble oxalate into the cooking water.",
  "taxonomy": {
    "food_family": "vegetables-mushrooms",
    "food_subcategories": [
      "spinach",
      "leafy-greens"
    ],
    "article_types": [
      "comparisons",
      "cooking-science"
    ],
    "primary_article_type": "comparisons"
  },
  "content_html": "<p>A bowl overflowing with raw spinach can collapse into a few spoonfuls after cooking. That change in volume explains much of what looks dramatic in a 100-gram nutrition table.</p><table><thead><tr><th>Approx. per 100 g</th><th>Raw</th><th>Boiled/drained</th></tr></thead><tbody><tr><td>Iron</td><td>~2.7 mg</td><td>~3.5–3.7 mg</td></tr><tr><td>Calcium</td><td>~100 mg</td><td>~130–140 mg</td></tr><tr><td>Vitamin C</td><td>~28 mg</td><td>~10 mg</td></tr><tr><td>Fiber</td><td>~2.2 g</td><td>~2.4 g</td></tr></tbody></table><p>Cooking did not create iron. Water balance, volume and the specific samples used in food databases explain much of the concentration change.</p><h2>A cooked serving contains far more leaves</h2><p>Thirty grams of raw spinach supplies only around 0.8 mg iron. A 180 g cooked portion can exceed 6 mg because that serving represents a much larger quantity of collapsed leaves.</p><h2>Sensitive vitamins pay a heat cost</h2><p>Vitamin C and folate can be degraded or lost into cooking water. Boiling and draining generally loses more water-soluble nutrients than methods using less water.</p><h2>Oxalate matters especially for calcium</h2><p>Spinach is high in oxalate, which binds calcium and sharply reduces its absorption; NIH estimates that only about 5% of spinach calcium is absorbed. Boiling can move some soluble oxalate into discarded cooking water. Iron is a separate issue: spinach iron is nonheme and its absorption depends on the meal matrix, but oxalate itself does not appear to be an important inhibitor of nonheme iron absorption in humans.</p><p>Cooking spinach changes concentration as well as chemistry. A large bowl of raw leaves collapses to a small portion because water is lost and the leaf structure softens. If you compare equal weights, cooked spinach can look more concentrated in several minerals and carotenoids; if you compare the amount of leaves you would realistically eat, the difference may be even larger because it is easy to consume far more spinach once it is cooked. That does not mean heat creates nutrients, only that the serving becomes denser.</p><p>Heat also makes some compounds easier to access. Softening plant cell walls can improve the release of carotenoids such as beta-carotene and lutein, especially when the meal includes a little fat. At the same time, vitamin C and folate are more vulnerable to heat and water. Boiling can move water-soluble nutrients into the cooking liquid, while quick sautéing or steaming usually exposes the leaves to less water. Using the liquid in a soup or stew can recover some of what leached out.</p><p>Oxalate is another reason raw and cooked spinach are not interchangeable nutritionally. Spinach contains a lot of oxalate, which can bind calcium and reduce how much of that calcium is available for absorption. Cooking, particularly boiling and discarding the water, can lower soluble oxalate, although it does not turn spinach into a major calcium source. People prone to calcium-oxalate kidney stones may have personal dietary advice that goes beyond the needs of the general population.</p><p>There is no need to choose one form permanently. Raw spinach works well in salads and sandwiches and preserves heat-sensitive vitamins; cooked spinach makes a larger quantity of leaves easier to eat and can improve access to certain carotenoids. Alternating both forms is a simple way to benefit from their different strengths.</p><p>The cooking medium can shift the final nutrient profile as much as raw versus cooked. Spinach sautéed in a teaspoon of olive oil gains a little energy but the fat can help with carotenoid absorption. Creamed spinach, spinach cooked with large amounts of cheese, or a buttery gratin is a different dish nutritionally. On the other hand, adding spinach to lentils, beans, eggs, pasta, or soup can increase vegetable volume without making spinach carry the entire meal.</p><p>Iron deserves careful wording because spinach contains a respectable amount on paper but it is non-heme iron, and absorption varies with the rest of the meal. Vitamin C-rich foods such as peppers, citrus, tomatoes, or fruit can improve non-heme iron absorption, while oxalate and other plant compounds reduce availability to some degree. This is one reason spinach should be seen as one contributor within a varied diet rather than as a uniquely powerful iron treatment. People with diagnosed iron deficiency should follow clinical advice rather than rely on changing spinach preparation alone.</p><h2>The takeaway</h2><p>Raw spinach better preserves some sensitive vitamins and adds volume; cooked spinach lets you eat much more leaf in a compact serving. Both are useful, and serving weight plus mineral bioavailability explain much of the practical difference.</p>",
  "faq": [
    {
      "question": "Why does cooked spinach have more iron per 100 g?",
      "answer": "Mostly because water, volume and concentration change. Cooking does not create iron."
    },
    {
      "question": "Does cooking spinach reduce oxalate?",
      "answer": "Boiling can move some soluble oxalate into the cooking water, which is then discarded."
    }
  ],
  "sources": [
    {
      "name": "USDA FoodData Central",
      "url": "https://fdc.nal.usda.gov/",
      "note": "Raw and cooked spinach nutrient values."
    },
    {
      "name": "NIH Office of Dietary Supplements — Calcium",
      "url": "https://ods.od.nih.gov/factsheets/Calcium-HealthProfessional/",
      "note": "Low calcium absorption from spinach because of compounds such as oxalate."
    },
    {
      "name": "PubMed — Oxalic acid does not influence nonhaem iron absorption in humans",
      "url": "https://pubmed.ncbi.nlm.nih.gov/17440529/",
      "note": "Human study of oxalate and nonheme iron absorption."
    }
  ],
  "image": {
    "concept": "Large bowl of raw spinach beside a small compact serving of cooked spinach representing similar leaves, no text.",
    "alt": "Raw spinach compared with cooked spinach"
  },
  "status": "publish"
}
