{"schema_version":1,"id":"en-709-erythritol-xylitol-sorbitol","article_number":709,"translation_group":"709-erythritol-xylitol-sorbitol","language":"en","locale":"en-US","market_context":"United States; sugar alcohol nutrition, labeling, and household safety","title":"Erythritol, Xylitol, and Sorbitol: What Is the Difference?","slug":"erythritol-xylitol-sorbitol","seo":{"title":"Erythritol vs Xylitol vs Sorbitol","meta_description":"All three are sugar alcohols, but they differ in sweetness, calories, absorption, and texture. Erythritol provides about 0.2 kcal/g, xylitol about 2.4, and sorbitol about 2.6 under U.S. labeling factors.","search_intent":"Compare erythritol, xylitol, and sorbitol for sweetness, calories, digestion, and practical use."},"excerpt":"Erythritol, xylitol, and sorbitol are different polyols, not interchangeable versions of one ingredient. Erythritol contributes very little energy; xylitol is about as sweet as sugar, while sorbitol is less sweet and strongly humectant.","taxonomy":{"food_family":"cocoa-sweets","food_subcategories":["erythritol","xylitol","sorbitol"],"article_types":["comparisons","nutrition-composition","myths-faq"],"primary_article_type":"comparisons"},"content_html":"<p>All three sit under the “sugar alcohol” umbrella, but they do not taste or behave the same. <strong>Erythritol, xylitol, and sorbitol differ in sweetness, energy, absorption, and the amount that reaches the large intestine.</strong></p><table><thead><tr><th>Polyol</th><th>Approx. sweetness vs sugar</th><th>U.S. energy factor</th></tr></thead><tbody><tr><td>Erythritol</td><td>60–80%</td><td>≈0.2 kcal/g</td></tr><tr><td>Xylitol</td><td>≈100%</td><td>≈2.4 kcal/g</td></tr><tr><td>Sorbitol</td><td>50–60%</td><td>≈2.6 kcal/g</td></tr></tbody></table><h2>Erythritol is mostly absorbed and excreted</h2><p>Much of it is absorbed in the small intestine and leaves the body largely unchanged. That explains its very low calorie contribution and why it often creates a noticeable cooling sensation as it dissolves.</p><h2>Xylitol matches sugar's sweetness more closely</h2><p>Xylitol works well when a formulation needs roughly sugar-like sweetness without sucrose. It is common in chewing gum and oral-care products. Larger servings can still cause gastrointestinal symptoms because absorption is incomplete.</p><p>One household caution matters: <strong>xylitol is toxic to dogs, so foods and sweetener containers that contain it should be kept securely out of their reach.</strong> If a dog gets into a xylitol-containing product, contact a veterinarian or emergency animal clinic immediately.</p><h2>Sorbitol is less sweet and strongly holds water</h2><p>Sorbitol is useful as both a sweetener and a humectant, helping products stay soft. Its incomplete absorption also means larger amounts are more likely to cause gas, bloating, or diarrhea.</p><h2>Choose by function, not only calories</h2><p>Cooling, crystallization, moisture, sweetness, and digestive tolerance all affect the finished food. <strong>The lowest-calorie polyol is not automatically the best technical substitute for every recipe.</strong></p><h2>Digestive tolerance can matter more than sweetness</h2>\n<p>Sugar alcohols that are not fully absorbed can reach the large intestine, where they may draw in water or be fermented by microbes. The effect differs by molecule and by person. Sorbitol commonly causes symptoms at lower amounts than erythritol, while xylitol often falls somewhere between. A few pieces of gum are not the same exposure as a large serving of sugar-free dessert.</p>\n<p>If these sweeteners are new to you, portion size is a more practical starting point than the calorie number on the front of the package.</p>\n<h2>They do not replace table sugar identically in baking</h2>\n<p>Sucrose provides bulk, holds water, supports browning, and changes freezing behavior. Erythritol can recrystallize and create a cooling sensation; xylitol stays moist and is closer to sugar in sweetness; sorbitol is a strong humectant. A one-for-one swap can therefore change texture, color, and shelf stability even when sweetness seems similar.</p>\n<p>Commercial blends often combine sweeteners because one ingredient alone cannot reproduce every function of sugar.</p>\n<h2>Xylitol requires special care around dogs</h2>\n<p>Xylitol is acutely toxic to dogs and can appear in gum, candy, dental products, and some nut-butter formulations. Keep xylitol-containing foods well out of reach, and accidental ingestion warrants urgent veterinary guidance. This specific canine hazard should not be generalized to every sugar alcohol, but none of these products belongs in a pet's diet.</p>\n<p>For human use, the sensible choice depends on digestive tolerance, recipe performance, cost, and the reason for reducing sugar. “Sugar alcohol” names a category, not a promise that all members behave the same way.</p><p>For dental health, xylitol and some other polyols are useful because oral bacteria do not handle them the same way they handle sucrose. That helps explain their use in sugar-free gum and candy, but those products do not replace brushing with fluoride toothpaste. Dental advantages and digestive tolerance are separate questions and can point in different directions as the dose increases.</p><p>Price and availability also shape everyday use. Erythritol is common in tabletop blends, xylitol appears frequently in gum and dental products, and sorbitol is widely used in confectionery and as a humectant. Choosing the ingredient that matches the job can prevent wasting an expensive sweetener in a recipe where its physical behavior is a poor fit.</p><p>When comparing packaged products, check whether the named polyol is the main sweetener or only one part of a blend; the digestive and taste effects may reflect the full mixture.</p><p>When trying one for the first time, use a small amount before reformulating an entire recipe. That gives you a chance to judge aftertaste, cooling sensation, texture, and digestive tolerance without wasting a batch.</p><p>It also helps reveal whether a cooling sensation or lingering aftertaste is acceptable before the ingredient becomes the dominant sweetener.</p>","faq":[{"question":"Which sugar alcohol has the fewest calories?","answer":"Erythritol contributes very little energy, about 0.2 calorie per gram under U.S. labeling factors."},{"question":"Which is sweetest?","answer":"Xylitol is roughly as sweet as sugar; erythritol and sorbitol are generally less sweet."},{"question":"Can sugar alcohols cause stomach upset?","answer":"Yes. Larger amounts can cause gas, bloating, or diarrhea, with tolerance varying by polyol and person."}],"sources":[{"name":"21 CFR 101.9","url":"https://www.ecfr.gov/current/title-21/chapter-I/subchapter-B/part-101/subpart-A/section-101.9","note":"U.S. calorie factors for individual sugar alcohols."},{"name":"FDA — Nutrition Facts Label","url":"https://www.fda.gov/food/food-labeling-nutrition/nutrition-facts-label","note":"Sugar-alcohol and carbohydrate labeling context."},{"name":"FDA — Paws Off! Xylitol is Toxic to Dogs","url":"https://www.fda.gov/animal-veterinary/animal-health-literacy/paws-xylitol-toxic-dogs","note":"FDA veterinary warning on xylitol poisoning in dogs and the need for urgent veterinary care."}],"image":{"concept":"Three small bowls of erythritol, xylitol, and sorbitol crystals side by side, clean editorial food photography, no text.","alt":"Erythritol, xylitol, and sorbitol"},"status":"publish"}
