{"schema_version":1,"id":"es-451-verduras-hierro","article_number":451,"translation_group":"451-vegetables-highest-iron","language":"es","locale":"es-ES","market_context":"España/Unión Europea; comparación aproximada de hierro en verduras crudas y contexto de absorción.","title":"Las verduras con más hierro","slug":"verduras-con-mas-hierro","seo":{"title":"Las verduras con más hierro por 100 gramos","meta_description":"Espinaca y hojas de remolacha rondan 2,5–2,7 mg de hierro/100 g; espárrago cerca de 2,1 y acelga alrededor de 1,8. Es hierro no hemo y su absorción varía.","search_intent":"Comparar verduras ricas en hierro con cifras y entender la absorción del hierro vegetal."},"excerpt":"Entre verduras habituales, la espinaca cruda ronda 2,7 mg de hierro por 100 g, las hojas de remolacha aproximadamente 2,6 mg, el espárrago cerca de 2,1 mg y la acelga alrededor de 1,8 mg. Son cifras de hierro total; el hierro vegetal es no hemo y se absorbe peor que el hierro hemo de origen animal.","taxonomy":{"food_family":"vegetables-mushrooms","food_subcategories":[],"article_types":["rankings","nutrition-composition"],"primary_article_type":"rankings"},"content_html":"<p>La espinaca tiene fama de ser la reina del hierro, pero el contexto importa. <strong>Varias hojas verdes aportan cantidades similares, y el número de la tabla no equivale a la cantidad que finalmente absorbe el organismo.</strong></p><h2>Comparación aproximada por 100 g en crudo</h2><table><thead><tr><th>Verdura</th><th>Hierro aprox.</th></tr></thead><tbody><tr><td>Espinaca</td><td>~2,7 mg</td></tr><tr><td>Hojas de remolacha</td><td>~2,6 mg</td></tr><tr><td>Espárrago</td><td>~2,1 mg</td></tr><tr><td>Acelga</td><td>~1,8 mg</td></tr><tr><td>Kale/col rizada</td><td>~1,5 mg</td></tr><tr><td>Brócoli</td><td>~0,7 mg</td></tr></tbody></table><p>Las cifras son redondeadas y dependen de variedad y preparación.</p><h2>El hierro de las verduras es no hemo</h2><p>El NIH explica que el hierro no hemo de alimentos vegetales tiene una absorción más variable que el hierro hemo. Fitatos y algunos polifenoles pueden reducirla, mientras la vitamina C mejora la absorción al consumirse en la misma comida.</p><h2>Un ejemplo práctico</h2><p>Una ensalada con 50 g de espinaca aporta aproximadamente 1,3 mg de hierro, no 2,7 mg. Añadir pimiento rojo, tomate o fruta rica en vitamina C puede favorecer el aprovechamiento de ese hierro no hemo.</p><h2>La absorción importa tanto como la cifra de la tabla</h2><p>El hierro vegetal es hierro no hemo y su absorción varía más que la del hierro hemo de alimentos animales. Combinar verduras o legumbres con una fuente de vitamina C puede mejorar la absorción; tomar grandes cantidades de ciertos inhibidores en la misma comida puede reducirla.</p><p>Eso no invalida el ranking, pero cambia su lectura. Una verdura con 2 mg por 100 g no equivale automáticamente a 2 mg absorbidos, y una ración grande de legumbres puede aportar más hierro total que una pequeña guarnición de la verdura que encabeza la lista.</p><h2>Las legumbres cambian el ranking</h2><p>Si ampliamos la comparación más allá de “verduras”, lentejas, garbanzos, judías y soja suelen aportar bastante hierro por ración y son fuentes vegetales muy relevantes. Aquí se han dejado fuera para mantener el ranking centrado en hortalizas.</p><p><strong>La espinaca sí aporta hierro, pero no es un alimento milagroso: cantidad consumida, biodisponibilidad y combinación de la comida importan tanto como la cifra por 100 g.</strong></p>\n<h2>Una verdura “rica en hierro” depende de la ración y de si está cocinada</h2>\n<p>Las comparaciones se distorsionan cuando se mezclan datos de verduras crudas y cocidas. Al cocinar hojas verdes se pierde volumen y parte del agua, por lo que 100 g de espinaca cocida representan mucha más cantidad vegetal que 100 g de espinaca cruda. La cifra por 100 g puede subir de forma llamativa sin que haya aparecido hierro nuevo. Para decidir qué comer, la aportación de una guarnición o un plato habitual suele ser más intuitiva.</p>\n<p>Guisantes, hojas verdes, brócoli y otras verduras añaden además folato, vitamina K, carotenoides, fibra y potasio. Elegirlas únicamente por hierro deja fuera buena parte de su interés nutricional. Una mezcla frecuente de verduras ofrece más ventajas que perseguir siempre la que figure primera en una tabla.</p>\n<h2>El hierro vegetal se absorbe de forma diferente al hierro hemo</h2>\n<p>El hierro de las verduras es no hemo y su absorción depende de lo que acompaña al plato. La vitamina C ayuda: unas gotas de limón sobre verduras de hoja, tomate junto a legumbres o pimiento en una ensalada son combinaciones prácticas. Esto cobra mayor importancia cuando la mayor parte del hierro de la dieta procede de alimentos vegetales.</p>\n<p>Los oxalatos de la espinaca se citan a veces como si anularan por completo su hierro. La absorción es limitada, pero la verdura continúa aportando hierro y muchos otros nutrientes. La respuesta razonable es diversificar: acelga, kale, brócoli, legumbres, tofu, semillas y alimentos fortificados pueden complementar unas fuentes a otras.</p>\n<h2>Las verduras funcionan mejor dentro de una comida rica en hierro</h2>\n<p>Para muchas personas no resulta práctico alcanzar toda la recomendación diaria únicamente con verduras. Su gran ventaja es complementar alimentos más concentrados. Un bol de lentejas con pimiento asado y hojas verdes, tofu con brócoli o alubias con tomate reúne hierro y vitamina C en el mismo plato y facilita una ingesta suficiente sin depender de una sola fuente.</p>\n<p>Cuando existe una deficiencia diagnosticada, una clasificación de verduras no sustituye el tratamiento ni la búsqueda de la causa. Para alimentación cotidiana, en cambio, incluir verduras de hoja con regularidad junto a legumbres, cereales integrales, semillas y productos fortificados puede contribuir de manera consistente al aporte de hierro.</p>","faq":[{"question":"¿La espinaca es la verdura con más hierro?","answer":"Está entre las más altas habituales, alrededor de 2,7 mg/100 g, pero otras hojas como la de remolacha son muy similares."},{"question":"¿El hierro vegetal se absorbe igual que el de la carne?","answer":"No. El hierro no hemo vegetal tiene una absorción más variable y generalmente menor."},{"question":"¿Qué ayuda a absorber hierro vegetal?","answer":"Consumir vitamina C en la misma comida puede aumentar la absorción del hierro no hemo."}],"sources":[{"name":"USDA FoodData Central","url":"https://fdc.nal.usda.gov/food-search/","note":"Valores de hierro de verduras y hortalizas."},{"name":"NIH Office of Dietary Supplements — Iron Fact Sheet","url":"https://ods.od.nih.gov/factsheets/Iron-HealthProfessional/","note":"Explica hierro hemo/no hemo y factores que afectan a su absorción."}],"image":{"concept":"Espinaca, hojas de remolacha, espárragos, acelga, kale y brócoli agrupados sobre una mesa, fotografía editorial nutricional realista, sin texto.","alt":"Verduras con cantidades relevantes de hierro"},"status":"publish"}
