{"schema_version":1,"id":"en-828-black-spots-radish","article_number":828,"translation_group":"828-black-spots-radish","language":"en","locale":"en-US","market_context":"United States; household food quality, cooking, and food-safety guidance with U.S. sources where appropriate","title":"Black spots on a radish: when you can trim them and when to toss it","slug":"black-spots-radish","seo":{"title":"Black spots on radishes: trim or throw away?","meta_description":"A small dry superficial black mark may be trimmed if sound white flesh is immediately underneath. Deep, wet, soft, spreading spots or off odors mean discard the radish.","search_intent":"Distinguish superficial black marks on radishes from disease or decay that extends into the root."},"excerpt":"A small black spot that is dry and superficial can sometimes be trimmed away if the radish is firm and the flesh directly underneath is clean. If the lesion is sunken, wet, soft, spreading inward, moldy, or foul-smelling, discard the radish.","taxonomy":{"food_family":"vegetables-mushrooms","food_subcategories":["radish"],"article_types":["food-safety","buying-quality-ripeness","storage"],"primary_article_type":"food-safety"},"content_html":"<p>A black mark stands out sharply against a red or white radish, but <strong>depth and texture tell you more than the color itself</strong>. Some marks are superficial damage; others are associated with disease or decay.</p>\n<p>University of Minnesota Extension describes several root problems that can produce dark or sunken lesions, while UC Davis lists black spot and soft rots among radish postharvest disorders.</p>\n<h2>When a spot may be only skin-deep</h2>\n<p>If the mark is small, dry, and the radish remains hard, cut through it. If clean, firm flesh appears immediately underneath and there is no abnormal smell, trim the damaged area generously and use the rest promptly.</p>\n<p>A dry scar or abrasion behaves differently from a lesion that has changed the texture of the root.</p>\n<h2>When to stop trimming</h2>\n<p>A black area that extends toward the center, feels sunken or wet, or is surrounded by soft tissue can represent disease or rot. If each new slice still shows dark, deteriorated flesh, discard the radish rather than carving it down piece by piece.</p>\n<h2>Look at the whole root</h2>\n<ul><li><strong>One dry scar, root firm:</strong> trim and inspect.</li>\n<li><strong>Several sunken or cracked lesions:</strong> poor quality; inspect closely.</li>\n<li><strong>Dark tissue extending into soft flesh:</strong> discard.</li>\n<li><strong>Slime, mold, or unpleasant odor:</strong> discard.</li></ul>\n<p>A pithy old radish can also have a dry spongy center, but that is different from a wet black lesion. When both are present, judge the radish by the more serious sign.</p>\n<p><strong>Dry and superficial may be trimmable; dark, wet, and deep is a reason to toss the root.</strong> A cross-section tells you whether the problem ended at the skin or continued inward.</p>\n<h2>Cutting the radish open gives you more information than the skin alone</h2>\n<p>Radish skin can develop dark marks from abrasion, age, soil staining or localized tissue damage, and those causes are difficult to distinguish from the outside. A clean cut through the affected area is often the most useful check. Healthy radish flesh should be firm, crisp and moist-looking without being watery or slimy. If a dark mark is confined to a thin layer of skin and the flesh below is solid and normally colored, trimming that section is reasonable. A root that has merely become a little pithy or dry may be less pleasant to eat, but that is different from wet decay.</p>\n<p>Discard the radish when black or brown tissue extends deep into the root, especially if it is soft, wet, hollow with dark breakdown, or accompanied by mold or an unpleasant odor. Multiple spreading spots are more concerning than one dry scar. The same principle applies to a bunch: one damaged radish does not automatically spoil every other root, but any neighboring radishes that are wet or touching decayed tissue should be checked carefully. Rinse sound roots just before use rather than storing them wet for long periods.</p>\n<p>For better storage, remove leafy tops if they are still attached because the leaves continue drawing moisture from the root. Keep the radishes refrigerated in a container or bag that limits dehydration without trapping excessive free moisture. Crisp roots last longer and are easier to assess than wrinkled ones. If they become slightly limp but remain clean-smelling and free from decay, texture can sometimes improve after a short soak in cold water. That trick is only for dehydration, not spoilage. When black spots come with softness, slime, mold or off odors, soaking or aggressive trimming is not a sensible rescue strategy.</p>\n<p>Radishes with intact, bright greens are often fresher at purchase, but those leaves should not remain attached for storage. They wilt quickly and pull water from the root. Separating them as soon as you get home helps the radish stay crisp, and the edible greens can be washed and cooked separately while still fresh.</p>\n<p>Small radishes generally dehydrate faster than large dense roots, so the same storage time can produce different texture within one bunch. Using the softer but sound roots first is a simple way to reduce waste while reserving the crispest ones for salads.</p>\n<p>If a cut radish looks normal but you are still unsure, use it promptly rather than returning it to storage for several more days. Once cut, the exposed surface loses moisture faster and is more vulnerable to quality decline, so refrigeration in a covered container and short storage are sensible.</p>","faq":[{"question":"Can I cut a black spot off a radish?","answer":"Yes, if the spot is small, dry, superficial, and clean firm flesh appears immediately underneath."},{"question":"Are black spots on radishes always mold?","answer":"No. They can come from injury or plant diseases as well as decay; wetness, softness, depth, and spreading damage matter more than color alone."},{"question":"When should I throw the whole radish away?","answer":"Discard it when dark damage extends into the flesh or appears with soft rot, slime, mold, or an off odor."}],"sources":[{"name":"University of Minnesota Extension — Radish Root Spots and Blotches","url":"https://apps.extension.umn.edu/garden/diagnose/plant/vegetable/radish/rootspots.html","note":"Describes diseases and disorders that produce dark or sunken lesions on radish roots."},{"name":"UC Davis Postharvest — Radish","url":"https://postharvest.ucdavis.edu/produce-facts-sheets/radish","note":"Covers pithiness, black spot, soft rots, freezing injury, and postharvest quality."}],"image":{"concept":"Red radish with one small dry black mark, sliced to show clean firm white flesh underneath, realistic food photo without text.","alt":"Radish with a superficial black spot and sound flesh beneath"},"status":"publish"}
