{
  "schema_version": 1,
  "id": "en-337-white-rice-nutrition",
  "article_number": 337,
  "translation_group": "337-white-rice-nutrition",
  "language": "en",
  "locale": "en-US",
  "market_context": "United States; plain cooked white rice",
  "title": "White rice: calories, carbs and nutrition",
  "slug": "white-rice-nutrition",
  "seo": {
    "title": "White rice: calories, carbs and nutrition",
    "meta_description": "Cooked white rice provides about 130 calories and 28 g carbohydrate per 100 g, with little fat or fiber. Dry rice looks much more calorie-dense because it contains far less water.",
    "search_intent": "Explain the nutrition of cooked white rice and why dry and cooked values differ so much."
  },
  "excerpt": "Cooked white rice provides about 130 calories and 28 g carbohydrate per 100 g, with very little fat and fiber. Dry rice looks far more calorie-dense per 100 g because cooking adds water and spreads the same energy across a heavier portion.",
  "taxonomy": {
    "food_family": "grains-pseudocereals",
    "food_subcategories": [
      "white-rice",
      "rice",
      "carbohydrates",
      "cooked-grains"
    ],
    "article_types": [
      "nutrition-composition"
    ],
    "primary_article_type": "nutrition-composition"
  },
  "content_html": "<p>Cooked white rice can look surprisingly light on a nutrition chart because much of its cooked weight is water. That is why two numbers need to stay separate: <strong>100 g dry rice and 100 g cooked rice are not nutritionally concentrated to the same degree.</strong></p>\n<h2>What cooked white rice provides</h2>\n<p>A USDA reference for cooked long-grain white rice provides about <strong>130 calories, 28.2 g carbohydrate, 2.7 g protein and 0.4 g fiber per 100 g</strong>. Fat is very low, around 0.3 g.</p>\n<table><thead><tr><th>Per 100 g cooked</th><th>Approximate amount</th></tr></thead><tbody><tr><td>Calories</td><td>130 kcal</td></tr><tr><td>Carbohydrate</td><td>28.2 g</td></tr><tr><td>Protein</td><td>2.7 g</td></tr><tr><td>Fat</td><td>0.3 g</td></tr><tr><td>Fiber</td><td>0.4 g</td></tr></tbody></table>\n<p>Most of the energy comes from starch. White rice is not especially high in protein or fat, and refining removes much of the fiber-containing bran.</p>\n<h2>Why dry rice looks so much higher in calories</h2>\n<p>Dry long-grain white rice is around <strong>365 calories and 80 g carbohydrate per 100 g</strong> in a USDA reference. Cooking adds water and weight without creating calories. The same dry rice therefore spreads its energy across a much heavier cooked portion.</p>\n<p>A 70 g dry portion may finish at roughly two to three times that weight depending on the rice and cooking method. The calories have not vanished; the concentration has changed.</p>\n<h2>What does a normal serving look like?</h2>\n<p>A <strong>150 g cooked portion</strong> of the reference rice provides about <strong>195 calories and 42 g carbohydrate</strong>. At 200 g, that becomes roughly <strong>260 calories and 56 g carbohydrate</strong>.</p>\n<p>That is why “a bowl of rice” can mean very different nutrition numbers depending on the actual amount.</p>\n<h2>What refining changes</h2>\n<p>Milling removes the bran and germ, lowering fiber and removing some naturally occurring vitamins and minerals. In the United States, enriched white rice often has iron and several B vitamins added back, so micronutrient values differ between enriched and unenriched products.</p>\n<h2>Is white rice nutritionally empty?</h2>\n<p>No. It supplies carbohydrate and energy and can be part of a balanced meal. It simply <strong>does not provide much fiber</strong> and is less micronutrient-dense than an intact whole grain in several respects.</p>\n<p>Pairing rice with beans, vegetables, eggs, fish, meat or tofu changes the meal substantially by adding protein, fiber, fat and micronutrients.</p>\n<p>Cooling cooked rice and reheating it later can increase the amount of resistant starch slightly, but the effect should not be exaggerated. It does not turn white rice into a high-fiber food, and the total carbohydrate remains substantial. The bigger practical differences usually come from portion size and what the rice is served with.</p><p>Food safety is important because cooked rice can support Bacillus cereus if it sits warm for too long. Leftover rice should be cooled promptly, refrigerated, and reheated thoroughly rather than being left on the counter for hours. The problem is not that rice is uniquely dangerous, but that its spores can survive cooking and grow if storage is poor.</p><p>Pairing rice with protein, vegetables, and legumes changes the meal far more than focusing on the grain alone. Beans with rice add fiber and protein; vegetables add volume and micronutrients; eggs, fish, tofu, or poultry can make the plate more balanced. This also slows eating and may reduce the need for a very large rice portion.</p><p>White rice can be especially useful when a low-fiber, easily digested carbohydrate is desired, during some gastrointestinal problems or before certain types of exercise. Whole grains have advantages in fiber and micronutrients, but choosing white rice sometimes is not a nutritional failure when the overall diet is varied.</p><p>Rice type changes texture and glycemic response. Long-grain, basmati, jasmine, and short-grain varieties differ in starch composition, especially the balance of amylose and amylopectin. That affects stickiness and can influence how quickly the carbohydrate is digested, although preparation and meal composition still matter.</p><p>Rinsing rice mainly removes surface starch and can change texture; it does not wash away most of the carbohydrate. Enriched rice is a special case because aggressive rinsing may remove some added surface nutrients in products where fortification is applied externally. Package directions are useful when enrichment matters.</p><h2>The number worth remembering</h2>\n<p>For plain cooked white rice, <strong>about 130 calories and 28 g carbohydrate per 100 g</strong> is a useful reference. Portion size and how much water the rice absorbed are the main reasons your bowl may differ.</p>",
  "faq": [
    {
      "question": "How many calories are in 100 g cooked white rice?",
      "answer": "A USDA reference lists about 130 calories per 100 g cooked."
    },
    {
      "question": "How many carbs are in cooked white rice?",
      "answer": "About 28 g carbohydrate per 100 g in the reference used here."
    },
    {
      "question": "Why does dry rice have more calories per 100 g?",
      "answer": "Dry rice contains far less water. Cooking adds water and spreads the same energy over a heavier final weight."
    }
  ],
  "sources": [
    {
      "name": "USDA FoodData Central",
      "url": "https://fdc.nal.usda.gov/",
      "note": "Official food-composition database used for like-for-like nutrient comparisons."
    },
    {
      "name": "USDA FoodData Central — cooked long-grain white rice",
      "url": "https://fdc.nal.usda.gov/food-search/?query=rice%20white%20long-grain%20cooked",
      "note": "Reference values for energy, carbohydrate, protein, fat and fiber in cooked rice."
    },
    {
      "name": "USDA FoodData Central — dry long-grain white rice",
      "url": "https://fdc.nal.usda.gov/food-search/?query=rice%20white%20long-grain%20raw",
      "note": "Dry-rice reference used to explain water-driven concentration changes."
    }
  ],
  "image": {
    "concept": "A bowl of plain cooked white rice with a small weighed portion nearby, natural editorial food photography, no text.",
    "alt": "Cooked white rice in a bowl"
  },
  "status": "publish"
}
